{"arm":"C_memory_candidate_index","candidate_index_content_hash":"aaaaaaaaaaaaaaaaaaaaaaaaaaaaaaaaaaaaaaaaaaaaaaaaaaaaaaaaaaaaaaaa","candidate_index_identity_hash":"aaaaaaaaaaaaaaaaaaaaaaaaaaaaaaaaaaaaaaaaaaaaaaaaaaaaaaaaaaaaaaaa","candidate_state":"incomplete","content_hash":"d5192fe7d97aa5177ad68179e974ed20320b0231ecdd493ea93c240c3c7b1307","format":"world-forge.codebase_memory_benchmark_observation","format_version":1,"measurements":{"cached_input_tokens":100,"critical_omission_count":0,"egress_guard":"unobserved","final_direct_verification":"unobserved","incremental_refresh_ms":null,"input_tokens":1000,"output_tokens":100,"quality_basis_points":9000,"task_wall_ms":250,"tree_guard":"unobserved"},"observation_id":"other_01_c_01","plan":{"content_hash":"21d0d72067f6f180a83aac8ccf71185a13e19c8a8804186c53866d54f8f42886","format":"world-forge.codebase_memory_benchmark_plan","format_version":1,"id":"benchmark_01"},"reason_codes":["candidate_index_incomplete"],"recorder_identity_hash":"bbbbbbbbbbbbbbbbbbbbbbbbbbbbbbbbbbbbbbbbbbbbbbbbbbbbbbbbbbbbbbbb","repetition_index":1,"rubric_evidence_hash":"cccccccccccccccccccccccccccccccccccccccccccccccccccccccccccccccc","source_mode":"memory_candidate_index","state":"incomplete","task_id":"other_01","toolchain_identity_hash":"dddddddddddddddddddddddddddddddddddddddddddddddddddddddddddddddd"}
