{"arm":"B_existing_memory","candidate_index_content_hash":null,"candidate_index_identity_hash":null,"candidate_state":null,"content_hash":"6b363d11fedd99a68b267b782e293c945361580c4b5bde48f5cac1681243dc57","format":"world-forge.codebase_memory_benchmark_observation","format_version":1,"measurements":{"cached_input_tokens":100,"critical_omission_count":0,"egress_guard":"pass","final_direct_verification":"pass","incremental_refresh_ms":null,"input_tokens":1000,"output_tokens":100,"quality_basis_points":9000,"task_wall_ms":250,"tree_guard":"pass"},"observation_id":"other_01_b_01","plan":{"content_hash":"21d0d72067f6f180a83aac8ccf71185a13e19c8a8804186c53866d54f8f42886","format":"world-forge.codebase_memory_benchmark_plan","format_version":1,"id":"benchmark_01"},"reason_codes":[],"recorder_identity_hash":"bbbbbbbbbbbbbbbbbbbbbbbbbbbbbbbbbbbbbbbbbbbbbbbbbbbbbbbbbbbbbbbb","repetition_index":1,"rubric_evidence_hash":"cccccccccccccccccccccccccccccccccccccccccccccccccccccccccccccccc","source_mode":"existing_memory","state":"completed","task_id":"other_01","toolchain_identity_hash":"dddddddddddddddddddddddddddddddddddddddddddddddddddddddddddddddd"}
